{"organizations": [], "uuid": "0abd7e2ff15ca4b257580e9a5569f0d3a6663f31", "thread": {"social": {"gplus": {"shares": 0}, "pinterest": {"shares": 0}, "vk": {"shares": 0}, "linkedin": {"shares": 0}, "facebook": {"likes": 0, "shares": 0, "comments": 0}, "stumbledupon": {"shares": 0}}, "site_full": "www.reuters.com", "main_image": "https://s4.reutersmedia.net/resources_v2/images/rcom-default.png", "site_section": "http://feeds.reuters.com/reuters/UKbankingFinancial/", "section_title": "Reuters: Financial Services and Real Estate", "url": "https://www.reuters.com/article/europe-stocks/live-markets-what-you-need-to-know-idUSL8N1PH17H", "country": "US", "domain_rank": 408, "title": "LIVE MARKETS-What you need to know", "performance_score": 0, "site": "reuters.com", "participants_count": 0, "title_full": "", "spam_score": 0.0, "site_type": "news", "published": "2018-01-22T09:43:00.000+02:00", "replies_count": 0, "uuid": "0abd7e2ff15ca4b257580e9a5569f0d3a6663f31"}, "author": "", "url": "https://www.reuters.com/article/europe-stocks/live-markets-what-you-need-to-know-idUSL8N1PH17H", "ord_in_thread": 0, "title": "LIVE MARKETS-What you need to know", "locations": [], "entities": {"persons": [{"name": "merkel", "sentiment": "none"}, {"name": "julien ponthus", "sentiment": "none"}], "locations": [{"name": "u.s.", "sentiment": "none"}, {"name": "atlantia", "sentiment": "none"}, {"name": "belgium", "sentiment": "none"}, {"name": "europe", "sentiment": "none"}, {"name": "london", "sentiment": "none"}, {"name": "france", "sentiment": "none"}, {"name": "washington", "sentiment": "none"}], "organizations": [{"name": "reuters", "sentiment": "negative"}, {"name": "spd", "sentiment": "none"}, {"name": "gkn", "sentiment": "none"}, {"name": "sanofi", "sentiment": "none"}]}, "highlightText": "", "language": "english", "persons": [], "text": "January 22, 2018 / 7:45 AM / in an hour LIVE MARKETS-What you need to know Reuters Staff 5 Min Read Jan 22 (Reuters) - Welcome to the home for real time coverage of European equity markets brought to you by Reuters stocks reporters and anchored today by Julien Ponthus. Reach him on Messenger to share your thoughts on market moves: julien.ponthus.thomsonreuters.com@reuters.net WHAT YOU NEED TO KNOW (0740 GMT) It seems to be business as usual so far on European stocks markets with futures indicating shares to rise slightly, expect in London with the FTSE losing a few points. That could change however with a prolonged stalemate in Washington but in the meantime, in Europe, prospects of talks between Merkel allies and the SPD should support sentiment. Main newsmaker this morning is France's Sanofi, which confirmed a bid for U.S. peer Bioverativ , another sign that M&A should indeed continue to spice things up. Switching from spice to sugar, Italian airports and motorway operator Atlantia is open to sweeten its bid to Abertis and other takeover preys, such as Ablynx in Belgium or GKN in the UK, expect their would-be suitors to cough up more cash to woo investors. A deal is not always needed though for shareholders to get extra cash: UBS proposed an increased dividend and new share buyback programme despite a hefty write down from a tax overhaul in the United States. Other movers today could include troubled South African retailer Steinhoff which plans to sell about 7.5 billion rand ($620 million) of shares in investment firm PSG Group it scrambles to plug a liquidity gap. Possible impact also of the chief executive of Dixons Carphone leaving Britain's largest electricals and mobile phone retailer to run the Boots chain. Also, platinum miner Lonmin reported a 65 percent drop in 2017 profit, citing higher costs and subdued commodity prices but reiterated its 2018 targets Please have a look below for a summary of our main headlines. (Julien Ponthus) MAIN HEADLINES (0740 GMT) Healthcare group Sanofi agrees to buy U.S. peer Bioverativ for $11.6 bln Richemont offers 2.8 bln euros to buy Yoox Net-A-Porter Steinhoff to place shares in PSG Group worth around $620 million UBS ups investor returns as US tax overhaul socks bank with quarterly loss Takeover target GKN raises forecast for electric driveline sales Dixons Carphone reports 6 percent jump in underlying revenue Dixons Carphone CEO James quits for job at Boots TUI sees record sales, earnings in 2018-paper Atlantia opens door to sweetening Abertis bid Takeaway.com says merger with Delivery Hero an option –paper UK Q4 motor insurance premiums fall 1.3 pct-survey Britain to limit gambling terminal stakes to two pounds-Sunday Times LVMH hires Hedi Slimane for Celine brand Engie to keep separate CEO, board chair roles -finance minister Deutsche Telekom expects steady dividend hikes –paper Hearing on Vivendi's appeal against Italian antitrust ruling postponed Schaeffler CEO says splitting company would be unwise -paper UK Takeover Panel extends deadline for IWG bidding Sika CEO says share price rise could end takeover battle UK's Computacenter says to beat 2017 expectations, sees stable 2018 Lonmin reports 65 percent fall in 2017 profit on higher costs (Tom Pfeiffer) EUROPE'S STOCK FUTURES SLIGHTLY UP (0705 GMT) Futures have opened with slight gains overal but London's FTSE 100 is seen, as earlier indications from spreadbetters showed, opening in negative territory. (Julien Ponthus) WHAT TO EXPECT ON MARKETS DURING A U.S. SHUTDOWN? (0645 GMT) While many see minimal impact on the economy from a short-term government shutdown, analysts say a prolonged stalemate in Washington could dampen investors' confidence in U.S. assets. Here's how Nordea sums up what's to be expected based on the previous shutdowns: (Julien Ponthus)", "external_links": [], "published": "2018-01-22T09:43:00.000+02:00", "crawled": "2018-01-22T10:26:01.002+02:00", "highlightTitle": ""}